{
  "schema_version": "agency-control.observation.v0.2",
  "event_id": "event-class-001",
  "environment_id": "a-prod",
  "installation_epoch": "epoch-a-prod-1",
  "sequence": 1,
  "observed_at": "2026-09-16T12:00:00Z",
  "object": {
    "domain": "bricks.global_class",
    "instance_uid": "class-button-a"
  },
  "projection": {
    "profile": "bricks-class-fixture-v1",
    "hash": "aaaaaaaaaaaaaaaaaaaaaaaaaaaaaaaaaaaaaaaaaaaaaaaaaaaaaaaaaaaaaaaa",
    "exists": true,
    "complete": true
  },
  "origin": "human",
  "causation_id": null
}
